{
  "schemaVersion": 1,
  "project": {
    "name": "运营支撑部项目",
    "locale": "zh-CN"
  },
  "calendar": {
    "id": "zh-CN",
    "weekStart": 1,
    "weekends": [
      0,
      6
    ],
    "holidays": [
      {
        "date": "2026-01-01",
        "name": "元旦",
        "type": "holiday"
      },
      {
        "date": "2026-01-02",
        "name": "元旦",
        "type": "holiday"
      },
      {
        "date": "2026-01-03",
        "name": "元旦",
        "type": "holiday"
      },
      {
        "date": "2026-02-15",
        "name": "春节",
        "type": "holiday"
      },
      {
        "date": "2026-02-16",
        "name": "春节（除夕）",
        "type": "holiday"
      },
      {
        "date": "2026-02-17",
        "name": "春节（正月初一）",
        "type": "holiday"
      },
      {
        "date": "2026-02-18",
        "name": "春节",
        "type": "holiday"
      },
      {
        "date": "2026-02-19",
        "name": "春节",
        "type": "holiday"
      },
      {
        "date": "2026-02-20",
        "name": "春节",
        "type": "holiday"
      },
      {
        "date": "2026-02-21",
        "name": "春节",
        "type": "holiday"
      },
      {
        "date": "2026-02-22",
        "name": "春节",
        "type": "holiday"
      },
      {
        "date": "2026-02-14",
        "name": "春节调休上班",
        "type": "working"
      },
      {
        "date": "2026-02-28",
        "name": "春节调休上班",
        "type": "working"
      },
      {
        "date": "2026-04-04",
        "name": "清明节",
        "type": "holiday"
      },
      {
        "date": "2026-04-05",
        "name": "清明节",
        "type": "holiday"
      },
      {
        "date": "2026-04-06",
        "name": "清明节",
        "type": "holiday"
      },
      {
        "date": "2026-05-01",
        "name": "劳动节",
        "type": "holiday"
      },
      {
        "date": "2026-05-02",
        "name": "劳动节",
        "type": "holiday"
      },
      {
        "date": "2026-05-03",
        "name": "劳动节",
        "type": "holiday"
      },
      {
        "date": "2026-05-04",
        "name": "劳动节",
        "type": "holiday"
      },
      {
        "date": "2026-05-05",
        "name": "劳动节",
        "type": "holiday"
      },
      {
        "date": "2026-04-26",
        "name": "劳动节调休上班",
        "type": "working"
      },
      {
        "date": "2026-06-19",
        "name": "端午节",
        "type": "holiday"
      },
      {
        "date": "2026-06-20",
        "name": "端午节",
        "type": "holiday"
      },
      {
        "date": "2026-06-21",
        "name": "端午节",
        "type": "holiday"
      },
      {
        "date": "2026-09-25",
        "name": "中秋节",
        "type": "holiday"
      },
      {
        "date": "2026-09-26",
        "name": "中秋节",
        "type": "holiday"
      },
      {
        "date": "2026-09-27",
        "name": "中秋节",
        "type": "holiday"
      },
      {
        "date": "2026-10-01",
        "name": "国庆节",
        "type": "holiday"
      },
      {
        "date": "2026-10-02",
        "name": "国庆节",
        "type": "holiday"
      },
      {
        "date": "2026-10-03",
        "name": "国庆节",
        "type": "holiday"
      },
      {
        "date": "2026-10-04",
        "name": "国庆节",
        "type": "holiday"
      },
      {
        "date": "2026-10-05",
        "name": "国庆节",
        "type": "holiday"
      },
      {
        "date": "2026-10-06",
        "name": "国庆节",
        "type": "holiday"
      },
      {
        "date": "2026-10-07",
        "name": "国庆节",
        "type": "holiday"
      },
      {
        "date": "2026-10-08",
        "name": "国庆节",
        "type": "holiday"
      },
      {
        "date": "2026-09-19",
        "name": "国庆节调休上班",
        "type": "working"
      },
      {
        "date": "2026-10-10",
        "name": "国庆节调休上班",
        "type": "working"
      }
    ],
    "workingHours": {
      "start": "09:00",
      "end": "18:00"
    }
  },
  "tasks": [
    {
      "id": "R_R1Vs-_Kp",
      "name": "框架下单",
      "parentId": null,
      "order": 0,
      "start": "2026-07-26",
      "end": "2026-08-20",
      "duration": 26,
      "progress": 4,
      "isMilestone": false,
      "dependencies": [],
      "constraints": {
        "type": "none"
      },
      "assignments": [],
      "customFields": {},
      "overtimeDates": []
    },
    {
      "id": "_8WNE1MfU9",
      "name": "二期定点配送OEM保存、详情接口联调",
      "parentId": "R_R1Vs-_Kp",
      "order": 0,
      "start": "2026-07-27",
      "end": "2026-07-29",
      "duration": 3,
      "progress": 0,
      "isMilestone": false,
      "dependencies": [],
      "constraints": {
        "type": "none"
      },
      "assignments": [
        {
          "resourceId": "JJK4zjydfe",
          "load": 100
        },
        {
          "resourceId": "kDkDVsiNq4",
          "load": 100
        }
      ],
      "customFields": {},
      "overtimeDates": []
    },
    {
      "id": "j7Jdjndy2U",
      "name": "二期充值订单预览、统一校验提示开发",
      "parentId": "R_R1Vs-_Kp",
      "order": 1,
      "start": "2026-07-30",
      "end": "2026-07-30",
      "duration": 1,
      "progress": 0,
      "isMilestone": false,
      "dependencies": [],
      "constraints": {
        "type": "none"
      },
      "assignments": [
        {
          "resourceId": "JJK4zjydfe",
          "load": 100
        }
      ],
      "customFields": {},
      "overtimeDates": []
    },
    {
      "id": "GJNWkMgeYs",
      "name": "二期充值订单预览、统一校验提示联调",
      "parentId": "R_R1Vs-_Kp",
      "order": 2,
      "start": "2026-07-31",
      "end": "2026-08-01",
      "duration": 1,
      "progress": 0,
      "isMilestone": false,
      "dependencies": [],
      "constraints": {
        "type": "none"
      },
      "assignments": [
        {
          "resourceId": "JJK4zjydfe",
          "load": 100
        },
        {
          "resourceId": "kDkDVsiNq4",
          "load": 100
        }
      ],
      "customFields": {},
      "overtimeDates": []
    },
    {
      "id": "1OPhNR8wU-",
      "name": "二期平台变更联调",
      "parentId": "R_R1Vs-_Kp",
      "order": 3,
      "start": "2026-07-26",
      "end": "2026-07-28",
      "duration": 2,
      "progress": 0,
      "isMilestone": false,
      "dependencies": [],
      "constraints": {
        "type": "none"
      },
      "assignments": [
        {
          "resourceId": "BMnBkiYYUg",
          "load": 50
        },
        {
          "resourceId": "oI31BD_7te",
          "load": 50
        }
      ],
      "customFields": {},
      "overtimeDates": []
    },
    {
      "id": "WuOPi8v4l-",
      "name": "历史数据补偿",
      "parentId": "R_R1Vs-_Kp",
      "order": 4,
      "start": "2026-08-01",
      "end": "2026-08-01",
      "duration": 0,
      "progress": 0,
      "isMilestone": false,
      "dependencies": [],
      "constraints": {
        "type": "none"
      },
      "assignments": [],
      "customFields": {},
      "overtimeDates": []
    },
    {
      "id": "o7addgAbDB",
      "name": "二期一阶段平台变更冒烟",
      "parentId": "R_R1Vs-_Kp",
      "order": 5,
      "start": "2026-07-29",
      "end": "2026-07-29",
      "duration": 1,
      "progress": 0,
      "isMilestone": false,
      "dependencies": [],
      "constraints": {
        "type": "none"
      },
      "assignments": [
        {
          "resourceId": "BMnBkiYYUg",
          "load": 100
        },
        {
          "resourceId": "oI31BD_7te",
          "load": 100
        }
      ],
      "customFields": {},
      "overtimeDates": []
    },
    {
      "id": "pL1aNyB6fX",
      "name": "一期测试",
      "parentId": "R_R1Vs-_Kp",
      "order": 6,
      "start": "2026-07-28",
      "end": "2026-07-30",
      "duration": 3,
      "overtimeDates": [],
      "progress": 0,
      "isMilestone": false,
      "dependencies": [],
      "constraints": {
        "type": "mustFinishOn",
        "date": "2026-07-30"
      },
      "assignments": [
        {
          "resourceId": "2RxQ0WLJXb",
          "load": 100
        }
      ],
      "customFields": {}
    },
    {
      "id": "yMa5ZKfgEh",
      "name": "二期测试",
      "parentId": "R_R1Vs-_Kp",
      "order": 7,
      "start": "2026-07-31",
      "end": "2026-08-05",
      "duration": 4,
      "overtimeDates": [],
      "progress": 0,
      "isMilestone": false,
      "dependencies": [
        {
          "targetId": "pL1aNyB6fX",
          "type": "FS",
          "lag": 0
        }
      ],
      "constraints": {
        "type": "finishNoLaterThan",
        "date": "2026-08-05"
      },
      "assignments": [
        {
          "resourceId": "2RxQ0WLJXb",
          "load": 100
        }
      ],
      "customFields": {},
      "note": ""
    },
    {
      "id": "XXnmEI_ST2",
      "name": "stage 测试（整体）",
      "parentId": "R_R1Vs-_Kp",
      "order": 8,
      "start": "2026-08-06",
      "end": "2026-08-12",
      "duration": 5,
      "overtimeDates": [],
      "progress": 0,
      "isMilestone": false,
      "dependencies": [
        {
          "targetId": "yMa5ZKfgEh",
          "type": "FS",
          "lag": 0
        }
      ],
      "constraints": {
        "type": "none"
      },
      "assignments": [
        {
          "resourceId": "2RxQ0WLJXb",
          "load": 100
        }
      ],
      "customFields": {}
    },
    {
      "id": "ODlk8LYWl4",
      "name": "灰度验证",
      "parentId": "R_R1Vs-_Kp",
      "order": 9,
      "start": "2026-08-13",
      "end": "2026-08-19",
      "duration": 5,
      "overtimeDates": [],
      "progress": 0,
      "isMilestone": false,
      "dependencies": [
        {
          "targetId": "XXnmEI_ST2",
          "type": "FS",
          "lag": 0
        }
      ],
      "constraints": {
        "type": "finishNoLaterThan",
        "date": "2026-08-19"
      },
      "assignments": [],
      "customFields": {}
    },
    {
      "id": "DEtdvLy3P7",
      "name": "发布生产",
      "parentId": "R_R1Vs-_Kp",
      "order": 10,
      "start": "2026-08-20",